timestamp,session id,query,response,crisis_flag
2025-08-01T09:46:42.891930,session_1754019950637_3t22bte5l,Im depressed. I want to give up,"It sounds like you're going through a really tough time. You're not alone, there are people who want to help you. Please consider reaching out to a mental health professional or contacting a helpline:

Bangladesh: 234378737537
You Matter.",True
2025-08-01T09:52:19.031363,session_1754020296351_mwi62ob92,hi,"<think>
Okay, so the user greeted me with ""hi"". I should respond in a friendly and approachable way. I want to make sure they feel comfortable asking anything, so I'll mention that I can help with questions or just chat. I'll keep it concise and warm.
</think>

Hello! How can I assist you today? Whether you have questions or just want to chat, I'm here to help!",False
2025-08-01T09:52:59.874353,session_1754020296351_mwi62ob92,I'm felling depressed,"
The user mentioned they're feeling depressed. I need to respond with empathy and support. I should acknowledge their feelings and offer help without being overwhelming. It's important to let them know they're not alone and that I'm here to listen or provide resources if they need it. I'll keep the tone gentle and understanding.
</think>

I'm really sorry to hear that you're feeling this way. It's important to remember that you're not alone, and there are people who care about you and want to support you. If you'd like, I can help you explore some coping strategies or suggest resources that might be helpful. Please know that I'm here to listen if you need someone to talk to.",False
2025-08-01T09:53:15.777118,session_1754020296351_mwi62ob92,I'm feeling stressed and overwhelmed. Can you help me with some stress management techniques?,"

Of course, I'm here to help! Managing stress and feeling overwhelmed can be challenging, but there are several techniques that might help you feel better. Here are a few you can try:

1. **Deep Breathing Exercises**: Take slow, deep breaths in through your nose and out through your mouth. This can help calm your body and mind. Try inhaling for a count of four, holding your breath for a count of four, and exhaling for a count of four. Repeat this a few times.

2. **Mindfulness Meditation**: Focus on the present moment without judgment. You can try a body scan, where you pay attention to each part of your body from head to toe, letting go of any tension as you go. Even just a few minutes a day can make a difference.

3. **Physical Activity**: Engage in some form of exercise, like a brisk walk, yoga, or even dancing to your favorite music. Exercise can help reduce stress by releasing endorphins, which are natural mood lifters.

4. **Time Management**: If you're feeling overwhelmed by tasks, try breaking them down into smaller, manageable steps. Prioritize what needs to be done and focus on one thing at a time. This can help you feel more in control.

5. **Grounding Techniques**: When you're feeling stressed, try grounding yourself by focusing on your senses. For example, name five things you can see, four things you can touch, three things you can hear, two things you can smell, and one thing you can taste. This can help bring you back to the present moment.

6. **Journaling**: Write down your thoughts and feelings. Sometimes getting things out of your head and onto paper can help you process and release them.

7. **Seek Social Support**: Talk to a trusted friend, family member, or colleague about how you're feeling. Social support can make a big difference in managing stress.

8. **Limit Stimuli**: If you're feeling overwhelmed, try to create a quieter, more peaceful environment. This could mean turning off the TV, taking a break from social media, or finding a quiet space to relax.

9. **Progressive Muscle Relaxation**: Tense and then relax each muscle group in your body, starting from your toes and moving up to your head. This can help release physical tension.

10. **Mindful Eating**: Pay attention to what you're eating and how it makes you feel. Eating nourishing foods and staying hydrated can help support your overall well-being.

Remember, it's important to take care of yourself, both physically and emotionally. If you're finding it hard to manage on your own, consider reaching out to a mental health professional who can provide additional support and guidance.

I hope these techniques help you feel a bit better. Let me know if you'd like more information or if there's anything else I can do to support you.",False
2025-08-01T09:55:47.049215,session_1754020443085_ub3etoj36,I'm not feeling good today. There's lot of work pressure on me. I'm feeling depressed. What should I do?,"<think>
Okay, so the user is feeling down because of work pressure and depression. I need to respond in a supportive way. First, I should acknowledge their feelings and let them know it's okay to feel this way. Maybe suggest taking a break to clear their mind. Deep breathing could help calm them down. I should also encourage them to talk to someone they trust. It's important to mention professional help if the feelings persist. Setting boundaries at work might help reduce the pressure, and self-care activities like exercise or hobbies could lift their mood. Reminding them they're not alone is crucial. I should keep the tone warm and understanding, avoiding any markdown or formal structures. Let me make sure each point is clear and offers practical advice without being overwhelming.
</think>

I'm really sorry to hear that you're feeling this way. It's important to take care of yourself, both mentally and emotionally. Here are a few things you can try:

1. **Take a Break**: Sometimes, stepping away from the situation can help clear your mind and reduce stress.

2. **Deep Breathing Exercises**: These can help calm your mind and reduce anxiety.

3. **Talk to Someone**: Reach out to a friend, family member, or someone you trust. Talking about how you feel can be incredibly helpful.

4. **Seek Professional Help**: If these feelings persist, consider reaching out to a mental health professional. They can provide you with the tools and support you need.

5. **Set Boundaries**: Learn to say ""no"" to tasks that are not essential. This can help reduce your workload and alleviate some of the pressure.

6. **Self-Care**: Engage in activities that you enjoy and that help you relax, such as reading, exercising, or spending time in nature.

Remember, you're not alone in feeling this way, and it's okay to ask for help. You deserve to feel better, and taking these steps can be a good start toward healing and managing your stress.",False
2025-08-01T09:56:39.847611,session_1754020443085_ub3etoj36,I'm experiencing anxiety. What can I do to calm down?,"

I'm sorry to hear that you're experiencing anxiety. Here are some strategies that might help you calm down:

1. **Deep Breathing**: Focus on slow, deep breaths. Inhale through your nose for a count of four, hold your breath for a count of four, and exhale through your mouth for a count of four. This can help slow down your heart rate and calm your mind.

2. **Grounding Techniques**: Try grounding yourself by focusing on your five senses. For example, name five things you can see, four things you can touch, three things you can hear, two things you can smell, and one thing you can taste. This can help bring you back to the present moment.

3. **Progressive Muscle Relaxation**: Tense and then relax each muscle group in your body, starting from your toes and moving up to your head. This can help release physical tension.

4. **Mindfulness Meditation**: Focus on the present moment without judgment. You can use a guided meditation app or simply pay attention to your breath.

5. **Physical Activity**: Engage in some form of physical activity, like going for a walk or doing some light stretching. Exercise can help reduce anxiety by releasing endorphins.

6. **Limit Stimulants**: Avoid caffeine, nicotine, and alcohol, as these can exacerbate anxiety.

7. **Talk to Someone**: Reach out to a trusted friend, family member, or mental health professional. Talking about your feelings can provide relief and perspective.

8. **Journaling**: Write down your thoughts and feelings. This can help you process and release emotions that may be contributing to your anxiety.

9. **Create a Calming Environment**: Play soothing music, dim the lights, or use a diffuser with calming scents like lavender.

10. **Challenge Negative Thoughts**: If you're experiencing racing or negative thoughts, try to challenge them by asking yourself if they're based in reality or if they're just anxiety talking.

Remember, it's important to be patient with yourself and to seek professional help if your anxiety becomes overwhelming or persistent. You're not alone in this, and there are many resources available to help you manage your anxiety.",False
2025-08-01T09:57:04.362917,session_1754020443085_ub3etoj36,What was my first question?,"<think>
Alright, let me try to figure out what the user is asking for here. They just asked, ""What was my first question?"" Looking back at the conversation history, the user initially mentioned feeling down because of work pressure and depression. They asked for advice on what to do. 

So, the user is now asking about their first question. It seems like they might be seeking confirmation or a reminder of their initial concern. Maybe they want to ensure that I understood their issue correctly or perhaps they're reflecting on their situation.

I should respond by clearly stating their first question to show that I remember and am paying attention. It's important to be accurate and empathetic in my response. I'll make sure to restate their question verbatim to maintain clarity and show that I'm engaged in the conversation.

I also need to consider why they're asking this now. It could be that they want to revisit the topic, or maybe they're checking if I'm consistent in my responses. Either way, providing a clear and accurate restatement of their first question is the best approach here.

So, I'll craft a response that acknowledges their first question, ensuring it's precise and shows understanding. This will help maintain trust and continue the conversation smoothly.
</think>

Your first question was about feeling unwell due to work pressure and depression, and you asked what you should do.",False
2025-08-01T09:57:36.748817,session_1754020443085_ub3etoj36,Thank you for your helpl,"

You're welcome! I'm glad I could help. If you ever need to talk or have more questions, feel free to reach out anytime. Take care of yourself!",False
